{
  "schema_version": "1.0.0",
  "hub_version": "0.1.0",
  "updated_at": "2026-09-02T00:00:00Z",
  "servers": [
    {
      "id": "MCP-DEV-001",
      "name": "GitHub MCP",
      "domain": "development",
      "owner": {"business": "Founder", "technical": "Sireh Digital Engineering"},
      "environment": ["development"],
      "transport": {"type": "stdio", "command": "${GITHUB_MCP_COMMAND}", "args": []},
      "enabled": false,
      "authentication": {"type": "oauth2", "credential_env": ["GITHUB_MCP_TOKEN"]},
      "capabilities": ["repository.search", "repository.inspect", "pull_request.draft"],
      "risk_class": "APPROVAL_REQUIRED",
      "health_check": {"type": "process", "enabled": false, "timeout_ms": 5000},
      "version": "unverified",
      "status": "REGISTERED",
      "documentation": "mcp/development/README.md"
    },
    {
      "id": "MCP-RES-001",
      "name": "Firecrawl MCP",
      "domain": "research",
      "owner": {"business": "Founder", "technical": "Sireh Digital Engineering"},
      "environment": ["development"],
      "transport": {"type": "http", "endpoint": "${FIRECRAWL_MCP_ENDPOINT}"},
      "enabled": false,
      "authentication": {"type": "api_key", "credential_env": ["FIRECRAWL_API_KEY"]},
      "capabilities": ["web.search", "web.retrieve", "web.analyze"],
      "risk_class": "READ_ONLY",
      "health_check": {"type": "http", "enabled": false, "path": "/health", "timeout_ms": 5000},
      "version": "unverified",
      "status": "REGISTERED",
      "documentation": "mcp/research/README.md"
    },
    {
      "id": "MCP-COM-001",
      "name": "Shopify MCP",
      "domain": "commerce",
      "owner": {"business": "Founder", "technical": "Sireh Digital Engineering"},
      "environment": ["development"],
      "transport": {"type": "http", "endpoint": "${SHOPIFY_MCP_ENDPOINT}"},
      "enabled": false,
      "authentication": {"type": "oauth2", "credential_env": ["SHOPIFY_MCP_TOKEN"]},
      "capabilities": ["catalog.inspect", "store.inspect", "catalog.draft"],
      "risk_class": "APPROVAL_REQUIRED",
      "health_check": {"type": "http", "enabled": false, "path": "/health", "timeout_ms": 5000},
      "version": "unverified",
      "status": "DRAFT",
      "documentation": "mcp/commerce/README.md"
    },
    {
      "id": "MCP-MKT-001",
      "name": "Meta Platform MCP",
      "domain": "marketing",
      "owner": {"business": "Founder", "technical": "Sireh Digital Engineering"},
      "environment": ["development"],
      "transport": {"type": "http", "endpoint": "${META_MCP_ENDPOINT}"},
      "enabled": false,
      "authentication": {"type": "oauth2", "credential_env": ["META_MCP_TOKEN"]},
      "capabilities": ["content.inspect", "content.draft", "content.publish"],
      "risk_class": "APPROVAL_REQUIRED",
      "health_check": {"type": "http", "enabled": false, "path": "/health", "timeout_ms": 5000},
      "version": "unverified",
      "status": "DRAFT",
      "documentation": "mcp/marketing/README.md"
    },
    {
      "id": "MCP-AUT-001",
      "name": "Hermes MCP Gateway",
      "domain": "automation",
      "owner": {"business": "Founder", "technical": "Sireh Digital Engineering"},
      "environment": ["development"],
      "transport": {"type": "stdio", "command": "${HERMES_MCP_COMMAND}", "args": []},
      "enabled": false,
      "authentication": {"type": "none", "credential_env": []},
      "capabilities": ["workflow.inspect", "workflow.draft", "audit.write"],
      "risk_class": "LOW_RISK_WRITE",
      "health_check": {"type": "process", "enabled": false, "timeout_ms": 5000},
      "version": "unverified",
      "status": "DRAFT",
      "documentation": "mcp/automation/README.md"
    }
  ]
}
